{
  "phase": "planning",
  "executionMode": "manual",
  "governanceScope": "CAMPAIGN",
  "nextAction": "Start new session with a reasoning model and say Start.",
  "productPhase": "BUILD",
  "batchNumber": 0,
  "active": null,
  "queue": [],
  "completed": [],
  "failed": [],
  "metrics": {
    "totalCompleted": 0,
    "totalFailed": 0,
    "consecutiveFailures": 0,
    "circuitBreakerTripped": false
  },
  "toolchain": {
    "checkCommands": [],
    "detected": false
  },
  "projectStructure": {
    "readme": null,
    "roadmap": null,
    "architecture": null,
    "productSpec": null,
    "conventions": null,
    "discovered": false
  },
  "perspectiveHistory": [],
  "humanTasksPending": false,
  "lastSession": {
    "perspective": null,
    "summary": "Workflow initialized.",
    "model": null,
    "batchNumber": 0,
    "timestamp": null
  },
  "currentBranch": null,
  "parallelGroups": {},
  "concurrency": {
    "budget": 1
  }
}
